,reviewer_name,review_date,review_star_text,review_star_count,review_helpful_count,review
113,Chirantan rocks,2 January 2019,Rated 1 stars out of five stars,1,15,"Worst app!!!! Earlier the app was working absolutely fine, but after the update it doesn't allow me to log in as always getting error and always Sms charges are getting deducted. I am trying to log in from my Registered number only, but still it's getting failed. Please fix it asap."
114,Rakshith Changappa,5 January 2019,Rated 1 stars out of five stars,1,4,Useless app. Just use private UPI apps instead. Half of the time the app doesnt open. Almost 2000 rs transactions are pending. No refund initiative done nor the amount is been credited to reciever. I dont know what they are doing with pending payments money.
115,Souranka Guha,9 January 2019,Rated 1 stars out of five stars,1,4,my bhim a/c is tempered with. saw the passcode changed as i tried to login but it was showing 'wrong passcode'. Then i tried unistalling and reinstalling the app. now the a/c linked with the sim card is not verifying. i cant open and check my bank a/c under this app. the customer service email is alFull Review
116,Amit Batra,18 December 2018,Rated 1 stars out of five stars,1,48,"Thousands of issues. This app comes with so many issues, that it leaves you with little choice, but to uninstall it sooner than later. This time I tried it after a gap of one year, hoping that the biggest issues may have been resolved by the development team. But I was mistaken. This app is being deFull Review"
117,Patel Deep,28 December 2018,Rated 2 stars out of five stars,2,14,"I have been using the app for over 1.5 years and it used to work fine. But when I installed the app in my new phone in this December (somewhere around 12 to 15 December 2018), it is not able to register my account. Whenever I tried to register from my number, it shows that account already exists, buFull Review"
118,Rishabh Kumar,6 January 2019,Rated 1 stars out of five stars,1,6,"I have Android Version 9, after uninstall and install this app, it is behaving strange, after language preference setting,mobile no verification and entering passcode, it shows - Select you bank. And after selecting bank and my account, it shows message as ""Account Exists"". Unable to go to Home PageFull Review"
